<?xml version="1.0" encoding="UTF-8"?>
<!DOCTYPE Config SYSTEM "config.dtd" >
<Config>
  <GeneralSettings>
    <preventInconsistency value="true"/>
    <multiplicityPreconditions integrated="true" separately="true"/>
    <reduceToSuperType ADD_REMOVE="true" CHANGE_LITERAL="true" CHANGE_REFERENCE="true" CREATE_DELETE="true" MOVE="true" MOVE_DOWN="true" MOVE_UP="true" SET_UNSET_ATTRIBUTE="true" SET_UNSET_REFERENCE="true"/>
    <disableVariants value="true"/>
    <modelUsesProfileMechanism value="true"/>
    <outputFolder absolutePath=""/>
    <createAllAttributes value="true"/>
  </GeneralSettings>
  <MetaModelSettings>
    <MainModel nsUri=""/>
  </MetaModelSettings>
  <Transformations>
    <Creates allow="true"/>
    <Deletes allow="true"/>
    <Moves allow="true" allowReferenceSwitching="true"/>
    <MoveUps allow="true" allowReferenceSwitching="true"/>
    <MoveDowns allow="true" allowReferenceSwitching="true"/>
    <SetAttributes allow="true"/>
    <UnsetAttributes allow="true"/>
    <SetReferences allow="true"/>
    <UnsetReferences allow="true"/>
    <Adds allow="true"/>
    <Removes allow="true"/>
    <ChangeLiterals allow="true" allowLiteralSwitching="true"/>
    <ChangeReferences allow="true"/>
  </Transformations>
  <Root name="" nested="true"/>
  <WhiteList/>
  <BlackList/>
</Config>
